{
  "$schema": "https://json-schema.org/draft/2020-12/schema",
  "$id": "https://example.local/dfir-agentic/contracts/auto.schema.json",
  "title": "DFIR Autonomous Execution Record",
  "type": "object",
  "additionalProperties": false,
  "required": [
    "auto_id",
    "timestamp_utc",
    "intake",
    "selection",
    "enforcement",
    "dispatch",
    "stages"
  ],
  "properties": {
    "auto_id": {
      "type": "string",
      "pattern": "^[a-zA-Z0-9_\\-\\.]+$"
    },
    "timestamp_utc": {
      "type": "string",
      "pattern": "^\\d{4}-\\d{2}-\\d{2}T\\d{2}:\\d{2}:\\d{2}Z$"
    },
    "intake": {
      "type": "object",
      "additionalProperties": false,
      "required": [
        "intake_id",
        "intake_json"
      ],
      "properties": {
        "intake_id": {
          "type": "string",
          "pattern": "^[a-zA-Z0-9_\\-\\.]+$"
        },
        "intake_json": {
          "type": "string",
          "minLength": 1
        }
      }
    },
    "selection": {
      "type": "object",
      "additionalProperties": false,
      "required": [
        "selected_agent",
        "selected_playbook",
        "kind"
      ],
      "properties": {
        "selected_agent": {
          "type": "string",
          "minLength": 1
        },
        "selected_playbook": {
          "type": "string",
          "minLength": 1
        },
        "kind": {
          "type": "string",
          "minLength": 1
        }
      }
    },
    "enforcement": {
      "type": "object",
      "additionalProperties": false,
      "required": [
        "allowed",
        "action",
        "details"
      ],
      "properties": {
        "allowed": {
          "type": "boolean"
        },
        "action": {
          "type": "string",
          "enum": [
            "dispatch_pipeline",
            "skip"
          ]
        },
        "details": {
          "type": "string",
          "minLength": 1
        }
      }
    },
    "dispatch": {
      "type": "object",
      "additionalProperties": false,
      "required": [
        "status",
        "dispatch_json",
        "run_id",
        "manifest_path"
      ],
      "properties": {
        "status": {
          "type": "string",
          "enum": [
            "ok",
            "skipped",
            "denied",
            "error"
          ]
        },
        "dispatch_json": {
          "type": [
            "string",
            "null"
          ]
        },
        "run_id": {
          "type": [
            "string",
            "null"
          ]
        },
        "manifest_path": {
          "type": [
            "string",
            "null"
          ]
        },
        "steps": {
          "type": "array",
          "description": "Pipeline execution step history",
          "items": {
            "type": "string"
          }
        }
      }
    },
    "stages": {
      "type": "object",
      "additionalProperties": false,
      "required": [
        "plaso",
        "enrichment",
        "merge"
      ],
      "properties": {
        "plaso": {
          "type": "string"
        },
        "chainsaw_evtx": {
          "type": "string"
        },
        "hayabusa_evtx": {
          "type": "string"
        },
        "appcompatcache": {
          "type": "string"
        },
        "mftecmd": {
          "type": "string"
        },
        "rbcmd": {
          "type": "string"
        },
        "lecmd": {
          "type": "string"
        },
        "recentfilecache": {
          "type": "string"
        },
        "jlecmd": {
          "type": "string"
        },
        "recmd": {
          "type": "string"
        },
        "plaso_evtx": {
          "type": "string"
        },
        "enrichment": {
          "type": "string"
        },
        "merge": {
          "type": "string"
        }
      }
    }
  }
}