{
  "auto_id": "eff24f3a-55a0-49d9-bdab-9ac1f67cefd0",
  "timestamp_utc": "2026-03-07T16:12:32Z",
  "intake": {
    "intake_id": "cda2e3e2-dad7-4172-a2d8-813d201cde49",
    "intake_json": "/home/nevermore/dfir-agentic/outputs/intake/ayuda/intake.json"
  },
  "selection": {
    "selected_agent": "triage_agent",
    "selected_playbook": "initial_access_v1",
    "kind": "unknown"
  },
  "enforcement": {
    "allowed": true,
    "action": "skip",
    "details": "no recommended pipeline"
  },
  "dispatch": {
    "status": "skipped",
    "dispatch_json": null,
    "run_id": null,
    "manifest_path": null
  },
  "stages": {
    "plaso": "skipped",
    "chainsaw_evtx": "skipped",
    "hayabusa_evtx": "skipped",
    "appcompatcache": "skipped",
    "mftecmd": "skipped",
    "rbcmd": "skipped",
    "lecmd": "skipped",
    "recentfilecache": "skipped",
    "jlecmd": "skipped",
    "recmd": "skipped",
    "enrichment": "ok",
    "merge": "skipped (missing baseline manifest)"
  }
}